"CWEHIV7M","journalArticle","2001","Shennan, Stephen; Wilkinson, J R","Ceramic Style Change and Neutral Evolution: A Case Study from Neolithic Europe","American Antiquity","","0002-7316","DOI: 10.2307/2694174","https://www.cambridge.org/core/product/99C26B88AFB5FF76A2630FA5DB53AF09","Following on the work of Dunnell, the evolutionary archaeology school has made a sharp distinction between functional and stylistic variation in archaeological artifacts. Variation is defined as functional if it is affected by selection processes and as stylistic if it is a result of processes of random drift. The argument has been further developed by Neiman (1995), who showed by simulation that processes of cultural mutation and drift could produce the kinds of ""battleship curves"" that generally characterize artifact-style frequency distributions through time, and also demonstrated that they could account for patterns of stylistic variation through time in Woodland-period ceramic assemblages from Illinois. In this paper we present a case study of change in the decoration of pottery from early Neolithic Central Europe. We show that the actual diachronic frequency distributions and those expected under the neutral model do not coincide and conclude that in this case the neutral model does not provide an adequate description of change in ceramic decoration. A model involving selection, in the form of a bias in favor of novelty in the later phases of the period studied, seems likely to be more appropriate, and we note the social interpretation of the original investigator of the data. In conclusion, it is suggested that neutral models provide an important heuristic tool but that there is not a radical break between functional and stylistic variation.","2001","2024-12-01 23:02:18","2024-12-05 19:48:17","","577-593","","4","66","","","","","","","","","","","","","","","","","Publisher: Cambridge University Press","","","","","","","","","","","","","","","","","","","","","","","","","","","","","","","","","","","","","","","","","","","","","","","","","","",""
"B85TGXFH","bookSection","2019","Kandler, Anne; Crema, Enrico R","Analysing Cultural Frequency Data: Neutral Theory and Beyond","Handbook of Evolutionary Research in Archaeology","978-3-030-11117-5","","","https://doi.org/10.1007/978-3-030-11117-5_5","In this chapter we review the application of neutral theory to archaeological case studies. In particular, we focus on commonly used neutrality tests and discuss the interpretation of their results. We argue that one needs to be careful with interpreting the consistency (or inconsistency) of archaeological data with theoretical neutral expectations as evidence for the absence (or presence) of selective force in the population. While neutral theory does very well in replicating various population-level frequency patterns, many alternative processes of cultural transmission may do so, too, making the pattern-matching approach a fairly weak approach for inferring underlying transmission processes. We advocate the use of generative inference frameworks as one possibility to go beyond the hypothesis testing approach. These frameworks do not only allow for the identification of the most likely underlying learning process given the empirical data but for a description of the breadth of processes that could have produced these data equally well. This brings us a step closer to understanding the limits to inferring underlying transmission processes from population-level frequency data and therefore the kinds of questions can be answered with which kinds of data.","2019","2024-12-01 23:03:00","2024-12-05 19:48:17","","83-108","","","","","","","","","","","Springer International Publishing","Cham","","","","","","","","DOI: 10.1007/978-3-030-11117-5_5","","","","","","Prentiss, Anna Marie","","","","","","","","","","","","","","","","","","","","","","","","","","","","","","","","","","","","","","","","","","","","",""
"EA4S45YH","journalArticle","2013","Kandler, Anne; Shennan, Stephen","A non-equilibrium neutral model for analysing cultural change","Journal of Theoretical Biology","","0022-5193","https://doi.org/10.1016/j.jtbi.2013.03.006","https://www.sciencedirect.com/science/article/pii/S0022519313000982","Neutral evolution is a frequently used model to analyse changes in frequencies of cultural variants over time. Variants are chosen to be copied according to their relative frequency and new variants are introduced by a process of random mutation. Here we present a non-equilibrium neutral model which accounts for temporally varying population sizes and mutation rates and makes it possible to analyse the cultural system under consideration at any point in time. This framework gives an indication whether observed changes in the frequency distributions of a set of cultural variants between two time points are consistent with the random copying hypothesis. We find that the likelihood of the existence of the observed assemblage at the end of the considered time period (expressed by the probability of the observed number of cultural variants present in the population during the whole period under neutral evolution) is a powerful indicator of departures from neutrality. Further, we study the effects of frequency-dependent selection on the evolutionary trajectories and present a case study of change in the decoration of pottery in early Neolithic Central Europe. Based on the framework developed we show that neutral evolution is not an adequate description of the observed changes in frequency.","2013","2024-12-01 23:04:09","2024-12-05 19:48:17","","18-25","","","330","","","","","","","","","","","","","","","","","","","","","","Neutral model; Conformity; Linear pottery culture; Markov chains; Wright–Fisher model","","","","","","","","","","","","","","","","","","","","","","","","","","","","","","","","","","","","","","","","","","","","","",""
"YF9NU3GP","journalArticle","1994","Slatkin, Montgomery","An exact test for neutrality based on the Ewens sampling distribution","Genetical Research","","0016-6723","DOI: 10.1017/S0016672300032560","https://www.cambridge.org/core/product/80F5ABCC3EEF65B742DC3A72DCCEB749","Using the Ewens sampling distribution of selectively neutral alleles in a finite population, it is possible to develop an exact test of neutrality by finding the probability of each configuration with the same sample size and observed number of allelic classes. The exact test provides the probability of obtaining a configuration with the same or smaller probability as the observed configuration under the null hypothesis. The results from the exact test may be quite different from those from the Ewens—Watterson test based on the homozygosity in the sample. The advantages and disadvantages of using an exact test in this and other population genetic contexts are discussed.","1994","2024-12-03 22:15:01","2024-12-05 19:48:17","","71-74","","1","64","","","","","","","","","","","","","","","","","Publisher: Cambridge University Press","","","","","","","","","","","","","","","","","","","","","","","","","","","","","","","","","","","","","","","","","","","","","","","","","","",""
"T6GU38QK","journalArticle","2024","Crema, Enrico R; Bortolini, Eugenio; Lake, Mark","How Cultural Transmission Through Objects Impacts Inferences About Cultural Evolution","Journal of Archaeological Method and Theory","","1573-7764","10.1007/s10816-022-09599-x","https://doi.org/10.1007/s10816-022-09599-x","The cross-fertilisation between biological and cultural evolution has led to an extensive borrowing of key concepts, theories, and statistical methods for studying temporal variation in the frequency of cultural variants. Archaeologists have been among the front-runners of those engaging with this endeavour, and the last 2 decades have seen a number of case studies where modes of social learning were inferred from the changing frequencies of artefacts. Here, we employ a simulation model to review and examine under-discussed assumptions shared by many of these applications on the nature of what constitutes the ‘population’ under study. We specifically ask (1) whether cultural transmission via ‘objects’ (i.e. public manifestations of cultural traits) generates distinct patterns from those expected from direct transmission between individuals and (2) whether basing inference on the frequency of objects rather than on the frequency of mental representations underlying the production of those objects may lead to biased interpretations. Our results show that the rate at which ideational cultural traits are embedded in objects, and shared as such, has a measurable impact on how we infer cultural transmission processes when analysing frequency-based archaeological data. At the same time, when cultural transmission is entirely mediated by the material representation of ideas, we argue that copying error should be interpreted as a two-step process which may occur in either one or both of embedding information in objects and retrieving it from them.","2024","2024-12-05 06:01:18","2024-12-05 19:48:17","","202-226","","1","31","","","","","","","","","","","","","","","","","","","","","","","","","","","","","","","","","","","","","","","","","","","","","","","","","","","","","","","","","","","","","","","","","","","",""
"GEUNNPV5","journalArticle","2014","Premo, L S","Cultural Transmission and Diversity in Time-Averaged Assemblages","Current Anthropology","","0011-3204","10.1086/674873","https://doi.org/10.1086/674873","Anthropologists have adopted methods from population genetics to study modes of cultural transmission in time-transgressive cultural data sets. However, it remains unclear to what extent methods originally developed to assess neutrality in genes sampled from a population at a single point in time are applicable to cultural variants sampled from assemblages. This report applies a suite of previously published methods to assemblages formed under unbiased cultural transmission. The results show that, even under the controlled conditions afforded by computer simulation, all but one method (the variants frequency approach) fail to identify unbiased cultural transmission in samples collected from moderately to severely time-averaged assemblages. While it is encouraging that the method that is best at identifying unbiased cultural transmission in simulated time-averaged data also is relatively robust to relative sample size, additional work is needed to determine whether even the variants frequency approach is powerful enough to identify ?weakly? biased forms of cultural transmission in real-world assemblages.","2014-02-01","2024-12-05 09:20:58","2024-12-05 19:48:17","","105-114","","1","55","","","","","","","","","","","","","","","","","Publisher: The University of Chicago Press","","","","","","","","","","","","","","","","","","","","","","","","","","","","","","","","","","","","","","","","","","","","","","","","","","",""
"DGGEY2RY","journalArticle","1995","Neiman, Fraser D","Stylistic Variation in Evolutionary Perspective: Inferences from Decorative Diversity and Interassemblage Distance in Illinois Woodland Ceramic Assemblages","American Antiquity","","0002-7316","DOI: 10.2307/282074","https://www.cambridge.org/core/product/69A948F595717901C75F84D033F1A1C9","Certain aspects of what archaeologists have traditionally called stylistic variation can be understood as the result of the introduction of selectively neutral variation into social-learning populations and the sampling error in the cultural transmission of that variation (drift). Simple mathematical models allow the deduction of expectations for the dynamics of these evolutionary mechanisms as monitored in the archaeological record through assemblage diversity and interassemblage distance. The models are applied to make inferences about the causes of change in decorative diversity and interassemblage distance for Woodland ceramics from Illinois.","1995","2024-12-05 09:20:58","2024-12-05 19:48:17","","7-36","","1","60","","","","","","","","","","","","","","","","","Publisher: Cambridge University Press","","","","","","","","","","","","","","","","","","","","","","","","","","","","","","","","","","","","","","","","","","","","","","","","","","",""
"DR2BTMKI","journalArticle","2017","O'Dwyer, James P; Kandler, Anne","Inferring processes of cultural transmission: the critical role of rare variants in distinguishing neutrality from novelty biases","Philosophical Transactions of the Royal Society B: Biological Sciences","","","10.1098/rstb.2016.0426","https://doi.org/10.1098/rstb.2016.0426","","2017-10-23","2024-12-05 19:47:33","2024-12-05 19:48:17","","20160426","","1735","372","","","","","","","","","","","","","","","","","Publisher: Royal Society","","","","","","","","","","","","","","","","","","","","","","","","","","","","","","","","","","","","","","","","","","","","","","","","","","",""
"JQBPLXKB","journalArticle","2004","Bentley, R Alexander; Hahn, Matthew W; Shennan, Stephen J","Random drift and culture change","Proceedings of the Royal Society of London. Series B: Biological Sciences","","","10.1098/rspb.2004.2746","https://doi.org/10.1098/rspb.2004.2746","","2004-07-22","2025-01-16 18:56:46","2025-01-16 18:56:49","","1443-1450","","1547","271","","","","","","","","","","","","","","","","","Publisher: Royal Society","","","","","","","","","","","","","","","","","","","","","","","","","","","","","","","","","","","","","","","","","","","","","","","","","","",""
"IL4XLUI3","journalArticle","2024","Deffner, Dominik; Fedorova, Natalia; Andrews, Jeffrey; McElreath, Richard","Bridging theory and data: A computational workflow for cultural evolution","Proceedings of the National Academy of Sciences","","","10.1073/pnas.2322887121","https://doi.org/10.1073/pnas.2322887121","Cultural evolution has made remarkable progress in both our theoretical and empirical understanding of how culture changes through time. However, a crucial challenge persists: closing the gap between theoretical models and real-world data. We propose a computational workflow that starts with theoretical models and directly guides data analysis, focusing on logically and transparently connecting theoretical implications with statistical procedures. Importantly, we also show how to step back from the basic outputs of data analysis to implications for both the studied population and theoretical model, highlighting avenues for the use of both ethnographic and experimental information. We argue these steps are not only necessary for principled research but contribute key insights to recent debates on scientific reform. Cultural evolution applies evolutionary concepts and tools to explain the change of culture over time. Despite advances in both theoretical and empirical methods, the connections between cultural evolutionary theory and evidence are often vague, limiting progress. Theoretical models influence empirical research but rarely guide data collection and analysis in logical and transparent ways. Theoretical models themselves are often too abstract to apply to specific empirical contexts and guide statistical inference. To help bridge this gap, we outline a quality-assurance computational workflow that starts from generative models of empirical phenomena and logically connects statistical estimates to both theory and real-world explanatory goals. We emphasize and demonstrate validation of the workflow using synthetic data. Using the interplay between conformity, migration, and cultural diversity as a case study, we present coded and repeatable examples of directed acyclic graphs, tailored agent-based simulations, a probabilistic transmission model for longitudinal data, and an approximate Bayesian computation model for cross-sectional data. We discuss the assumptions, opportunities, and pitfalls of different approaches to generative modeling and show how each can be used to improve data analysis depending on the structure of available data and the depth of theoretical understanding. Throughout, we highlight the significance of ethnography and of collecting basic cultural and demographic information about study populations and call for more emphasis on logical and theory-driven workflows as part of science reform.","2024-11-26","2025-03-02 13:36:26","2025-03-02 13:36:32","","e2322887121","","48","121","","","","","","","","","","","","","","","","","Publisher: Proceedings of the National Academy of Sciences","","","","","","","","","","","","","","","","","","","","","","","","","","","","","","","","","","","","","","","","","","","","","","","","","","",""
"EALCNSPG","journalArticle","2014","Acerbi, Alberto; Bentley, Alexander R","Biases in cultural transmission shape the turnover of popular traits","Evolution and Human Behavior","","1090-5138","https://doi.org/10.1016/j.evolhumbehav.2014.02.003","https://www.sciencedirect.com/science/article/pii/S1090513814000233","The neutral model of cultural evolution, which assumes that copying is unbiased, provides precise predictions regarding frequency distributions of traits and the turnover within a popularity-ranked list. Here we study turnover in ranked lists and identify where the turnover departs from neutral model predictions to detect transmission biases in three different domains: color terms usage in English language 20th century books, popularity of early (1880–1930) and recent (1960–2010) USA baby names, and musical preferences of users of the Web site Last.fm. To help characterize the type of transmission bias, we modify the neutral model to include a content-based bias and two context-based biases (conformity and anti-conformity). How these modified models match real data helps us to infer, from population scale observations, when cultural transmission is biased, and, to some extent, what kind of biases are operating at individual level.","2014","2025-04-02 15:33:22","2025-06-19 17:52:23","","228-236","","3","35","","","","","","","","","","","","","","","","","","","","","","Cultural evolution; Transmission biases; Neutral model; Baby names; Color terms; Musical preferences; Turnover","","","","","","","","","","","","","","","","","","","","","","","","","","","","","","","","","","","","","","","","","","","","","",""
"TKEPZS3M","journalArticle","2004","Kohler, Timothy A; VanBuskirk, Stephanie; Ruscavage-Barz, Samantha","Vessels and villages: evidence for conformist transmission in early village aggregations on the Pajarito Plateau, New Mexico","Journal of Anthropological Archaeology","","0278-4165","https://doi.org/10.1016/j.jaa.2003.12.003","https://www.sciencedirect.com/science/article/pii/S0278416503000837","Since at least the early 1900s archaeologists have been debating why villages form in the pre-hispanic US Southwest. Less emphasis has been placed on the factors enabling differential persistence of villages, once formed; yet village life poses problems of social coordination. We find that data from a recently excavated Late Coalition period village on the Pajarito Plateau of New Mexico, Burnt Mesa Pueblo, exhibits less diversity in ceramic style than would be expected, if ceramic styles were “neutral,” using as a baseline the ceramic diversity that typifies local hamlets of the Early Coalition period. The evidence suggests that the local transmission processes affecting ceramic design were biased towards conformity (i.e., exhibit frequency-dependent bias). We take conformity in ceramic design to be one symptom of a developing social system that places great value on within-group cooperation, helping alleviate cooperative dilemmas in these early aggregates.","2004","2025-04-07 10:55:34","2025-04-07 10:55:39","","100-118","","1","23","","","","","","","","","","","","","","","","","","","","","","Archaeology; Cultural transmission; Conformity; Aggregation; Ceramics; Cooperation; Style; US southwest","","","","","","","","","","","","","","","","","","","","","","","","","","","","","","","","","","","","","","","","","","","","","",""
"SFJHTUY7","journalArticle","2019","Vlachos, Christos; Burny, Claire; Pelizzola, Marta; Borges, Rui; Futschik, Andreas; Kofler, Robert; Schlötterer, Christian","Benchmarking software tools for detecting and quantifying selection in evolve and resequencing studies","Genome Biology","","1474-760X","10.1186/s13059-019-1770-8","https://doi.org/10.1186/s13059-019-1770-8","The combination of experimental evolution with whole-genome resequencing of pooled individuals, also called evolve and resequence (E&R) is a powerful approach to study the selection processes and to infer the architecture of adaptive variation. Given the large potential of this method, a range of software tools were developed to identify selected SNPs and to measure their selection coefficients.","2019","2025-05-20 16:39:46","2025-06-04 16:01:37","","169","","1","20","","","","","","","","","","","","","","","","","","","","","","","","","","","","","","","","","","","","","","","","","","","","","","","","","","","","","","","","","","","","","","","","","","","",""
"8NXA852G","journalArticle","2015","Porčić, Marko","Exploring the Effects of Assemblage Accumulation on Diversity and Innovation Rate Estimates in Neutral, Conformist, and Anti-Conformist Models of Cultural Transmission","Journal of Archaeological Method and Theory","","1573-7764","10.1007/s10816-014-9217-8","https://doi.org/10.1007/s10816-014-9217-8","Recent research has shown that accumulation and time averaging can affect the neutrality tests used in evolutionary archaeology. This study builds upon this line of research and explores the effects of assemblage accumulation and time averaging on diversity estimates and innovation rate estimates commonly used in evolutionary archaeology by simulating three kinds of transmission processes (neutral, conformist, and anti-conformist). Accumulation often results in equifinality, but in some cases, it is possible to identify the specific transmission process by looking at the patterns of covariation of diversity measures and the duration of an assemblage accumulation. The relevance of simulation results is illustrated by an archaeological example.","2015","2025-05-27 15:51:44","2025-06-04 16:01:37","","1071-1092","","4","22","","","","","","","","","","","","","","","","","","","","","","","","","","","","","","","","","","","","","","","","","","","","","","","","","","","","","","","","","","","","","","","","","","","",""
"5BSN2GR7","journalArticle","2008","Efferson, Charles; Lalive, Rafael; Richerson, Peter J; McElreath, Richard; Lubell, Mark","Conformists and mavericks: the empirics of frequency-dependent cultural transmission","Evolution and Human Behavior","","1090-5138","https://doi.org/10.1016/j.evolhumbehav.2007.08.003","https://www.sciencedirect.com/science/article/pii/S1090513807000876","Conformity is a type of social learning that has received considerable attention among social psychologists and human evolutionary ecologists, but existing empirical research does not identify conformity cleanly. Conformity is more than just a tendency to follow the majority; it involves an exaggerated tendency to follow the majority. The “exaggerated” part of this definition ensures that conformists do not show just any bias toward the majority, but a bias sufficiently strong to increase the size of the majority through time. This definition of conformity is compelling because it is the only form of frequency-dependent social influence that produces behaviorally homogeneous social groups. We conducted an experiment to see if players were conformists by separating individual and social learners. Players chose between two technologies repeatedly. Payoffs were random, but one technology had a higher expected payoff. Individual learners knew their realized payoffs after each choice, while social learners only knew the distribution of choices among individual learners. A subset of social learners behaved according to a classic model of conformity. The remaining social learners did not respond to frequency information. They were neither conformists nor nonconformists, but mavericks. Given this heterogeneity in learning strategies, a tendency to conform increased earnings dramatically.","2008","2025-05-27 15:54:15","2025-06-04 16:01:37","","56-64","","1","29","","","","","","","","","","","","","","","","","","","","","","Cultural transmission; Social learning; Conformity","","","","","","","","","","","","","","","","","","","","","","","","","","","","","","","","","","","","","","","","","","","","","",""
